{
  "blueprint_id": "",
  "project_name": "",
  "generated_from_blueprint": true,
  "flows": [
    {
      "id": "flow_001",
      "name": "",
      "description": "",
      "flow_type": "user_flow",
      "user_persona": "",
      "priority": "high",
      "framework_specific": false,
      "accessibility_validated": false,
      "steps": [
        {
          "id": "step_1",
          "page": "",
          "action": "",
          "task_id": "",
          "status": "pending",
          "emd_compliant": true,
          "validation_required": true
        }
      ],
      "connections": [
        {
          "from": "step_1",
          "to": "step_2",
          "condition": "",
          "edge_case_handling": ""
        }
      ],
      "completion_percentage": 0,
      "blocked": false,
      "blocker_reason": "",
      "parliamentary_approved": false,
      "consensus_score": 0.0
    }
  ],
  "total_flows": 0,
  "completed_flows": 0,
  "critical_path_identified": false,
  "dependencies_mapped": false
}